Year,Title,Conference
2014.4,Mid-term Results of Surgical Treatment for Post-infarction Ventricular Septal Rupture: Benefits of Modified Infarct Exclusion Techniques Using Sealants (poster),"The 22nd Annual Meeting of the Asian Society for Cardiovascular and Thoracic Surgery, Istanbul, Turkey"
2022.1,Repair Versus Replacement in Active Native Mitral Valve Endocarditis: A Propensity Score-Matched Study,"The 36th European Association for Cardio-Thoracic Surgery Annual Meeting, October 2022, Milan, Italy"
2023.6,Prophylactic surgery reduces aortic reoperation in Loeys-Dietz syndrome: the importance of early diagnosis (poster),"The 31st Annual Meeting of the Asian Society for Cardiovascular and Thoracic Surgery, Istanbul, Turkey"
2023.6,Clinical outcomes of surgical repair in mycotic aortic aneurysm: A 14-year single-center experience (poster),"The 31st Annual Meeting of the Asian Society for Cardiovascular and Thoracic Surgery, Istanbul, Turkey"
2023.6,The Role of Residual AR Jet Flow Direction in Valve-Sparing Root Replacement (poster),"The 31st Annual Meeting of the Asian Society for Cardiovascular and Thoracic Surgery, Istanbul, Turkey"
2024.4,Impact of the Grade and Jet Direction of Residual Aortic Regurgitation following Valve-sparing Root Replacement,"The 104th American Association for Thoracic Surgery Annual Meeting, April 2024, Toronto, Canada"